{
  "$schema": "https://json-schema.org/draft/2020-12/schema",
  "$id": "https://id.uvci.eu/DGC.schema.json",
  "title": "EU DGC",
  "description": "EU Digital Green Certificate",
  "required": [
    "ver",
    "nam",
    "dob"
  ],
  "type": "object",
  "properties": {
    "ver": {
      "title": "Schema version",
      "description": "Version of the schema, according to Semantic versioning (ISO, https://semver.org/ version 2.0.0 or newer)",
      "type": "string",
      "pattern": "^\\d+.\\d+.\\d+$",
      "examples": [
        "1.0.0"
      ]
    },
    "nam": {
      "description": "Surname(s), given name(s) - in that order",
      "$ref": "https://id.uvci.eu/DGC.Core.Types.schema.json#/$defs/person_name"
    },
    "dob": {
      "title": "Date of birth",
      "description": "Date of Birth of the person addressed in the DGC. ISO 8601 date format restricted to range 1900-2099",
      "type": "string",
      "format": "date",
      "pattern": "[19|20][0-9][0-9]-(0[1-9]|1[0-2])-([0-2][1-9]|3[0|1])",
      "examples": [
        "1979-04-14"
      ]
    },
    "v": {
      "description": "Vaccination Group",
      "type": "array",
      "items": {
        "$ref": "https://id.uvci.eu/DGC.Types.schema.json#/$defs/vaccination_entry"
      },
      "minItems": 1
    },
    "t": {
      "description": "Test Group",
      "type": "array",
      "items": {
        "$ref": "https://id.uvci.eu/DGC.Types.schema.json#/$defs/test_entry"
      },
      "minItems": 1
    },
    "r": {
      "description": "Recovery Group",
      "type": "array",
      "items": {
        "$ref": "https://id.uvci.eu/DGC.Types.schema.json#/$defs/recovery_entry"
      },
      "minItems": 1
    }
  }
}