{
    "ver": "1.0.0",
    "nam": {
        "fn": "d'Arsøns - van Halen",
        "gn": "François-Joan",
        "fnt": "DARSONS<VAN<HALEN",
        "gnt": "FRANCOIS<JOAN"
    },
    "dob": "2009-02-28",
    "v": [
        {
            "tg": "840539006",
            "vp": "1119349007",
            "mp": "EU/1/20/1528",
            "ma": "ORG-100030215",
            "dn": 1,
            "sd": 2,
            "dt": "2021-04-22",
            "co": "CH",
            "is": "Bundesamt für Gesundheit (BAG)",
            "ci": "01:CH:PlA8UWS60Z4RZVALl6GAZ:12"
        }
    ]
}
