{
    "ver": "1.0.0",
    "nam": {
        "fn": "d'Arsøns - van Halen",
        "gn": "François-Joan",
        "fnt": "DARSONS<VAN<HALEN",
        "gnt": "FRANCOIS<JOAN"
    },
    "dob": "2009-02-28",
    "t": [
        {
            "tg": "840539006",
            "tt": "LP217198-3",
            "tr": "260415000",
            "ma": "1232",
            "sc": "2021-04-13T14:20:00+00:00",
            "dr": "2021-04-13T14:40:01+00:00",
            "tc": "Amavita Apotheke Bahnhof Bern",
            "co": "CH",
            "is": "Bundesamt für Gesundheit (BAG)",
            "ci": "01:CH:PlA8UWS60Z4RZVALl6GAZ:12"
        }
    ]
}
