{
  "ver": "1.0.0",
  "nam": {
    "fn": "ابو بكر محمد بن زكريا الرازي",
    "fnt": "ABU<BAKR<MOHAMMED<IBN<ZAKARIA<AL<RAZI"
  },
  "dob": "2020-02-29",
  "v": [
    {
      "tg": "840539006",
      "vp": "1119349007",
      "mp": "EU/1/20/1528",
      "ma": "ORG-100030215",
      "dn": 2,
      "sd": 2,
      "dt": "2021-04-21",
      "co": "SA",
      "is": "Ministry of Public Health (MOH, وزارة الصحة)",
      "ci": "urn:uvci:01:NL:PlA8UWS60Z4RZXVALl6GAZ"
    }
  ]
}
